{
  "status": "passed",
  "quality_level": "high_quality",
  "scores": {
    "topic_score": 8.6,
    "first_3_seconds_score": 9.3,
    "first_5_seconds_score": 9.2,
    "script_score": 8.7,
    "semantic_score": 8.7,
    "save_value_score": 8.8,
    "proof_score": 8.7,
    "visual_score": 8.6,
    "aesthetic_score": 8.6,
    "sync_score": 9.0,
    "compliance_score": 9.5
  },
  "hard_gates": {
    "internal_dir_exists": true,
    "topic_candidates_exists": true,
    "selected_topic_exists": true,
    "copy_package_exists": true,
    "copy_package_json_exists": true,
    "semantic_review_passed": true,
    "compliance_passed": true,
    "storyboard_exists": true,
    "audio_locked": true,
    "asset_manifest_exists": true,
    "asset_validation_passed": true,
    "metadata_exists": true,
    "normal_tts_speed": true,
    "quality_spec_documented": true,
    "draft_video_exists": true,
    "script_score_exists": true,
    "storyboard_validation_exists": true,
    "storyboard_quality_spec_valid": true,
    "storyboard_layered_scene_design": true,
    "storyboard_scene_quality_checks_passed": true,
    "video_technical_qa_passed": true,
    "metadata_consistency_checked": true,
    "frame_review_exists": true,
    "visual_review_passed": true,
    "layered_scene_design": true,
    "scene_quality_checks_passed": true,
    "high_quality_render_policy": true,
    "not_static_image_only": true,
    "audio_video_synced": true,
    "cover_source_exists": true,
    "publish_copy_source_exists": true
  },
  "evidence_runtime_ratio": 0.62,
  "blocking_issues": [],
  "warnings": [],
  "revision_required": false
}
